{
  "kind": "THIN",
  "schemaVersion": "1",
  "eventId": "7b2d0a51-88c2-4f0e-9a77-1c0e4b6d2f30",
  "eventType": "COMPLAINTS_WORKFLOW_TRANSITIONED",
  "eventTime": "2026-09-21T09:12:44.088Z",
  "producer": "complaints-service",
  "module": "Complaints",
  "eventName": "COMPLAINTS.WORKFLOW.ASSIGN.PENDINGATLME",
  "ledgerEventName": "COMPLAINTS.WORKFLOW.ASSIGN",
  "entityType": "COMPLAINT",
  "entityId": "PGR-2026-000123",
  "tenantId": "ke.bomet",
  "transactionSeed": "PGR-2026-000123:ASSIGN:PENDINGATLME:7d2c4b1e-5f60-4a8b-9c3d-2e1f0a9b8c7d",
  "actors": {
    "citizen": {
      "userId": "9a1f2e77-0c3b-4c2a-9f3e-5a1d2c3b4e5f",
      "type": "CITIZEN",
      "name": "Amina Chebet",
      "phone": "+254712345678",
      "email": "amina@example.com"
    },
    "assignee": { "userId": "3c2b1a09-7f6e-4d5c-8b2a-1e0f9d8c7b6a", "type": "EMPLOYEE" }
  },
  "data": {
    "id": "PGR-2026-000123",
    "date": "21/09/2026",
    "complaint_type": "StreetLight",
    "status": "PENDINGATLME",
    "additional_comments": "Assigned to the ward team",
    "citizen_name": "Amina Chebet",
    "download_link": "https://s.gov/x1",
    "emp_name": "Peter Kirui"
  },
  "localized": {
    "complaint_type": ["COMPLAINT_HIERARCHY.StreetLight", "pgr.complaint.category.StreetLight"],
    "status": ["CS_COMMON_PENDINGATLME"],
    "ulb": ["BOMET"],
    "ao_designation": ["COMMON_MASTERS_DESIGNATION_AO"],
    "emp_department": ["COMMON_MASTERS_DEPARTMENT_DEPT_25"],
    "emp_designation": ["COMMON_MASTERS_DESIGNATION_AE"]
  },
  "localizationModules": ["rainmaker-pgr", "rainmaker-common"],
  "localizationLocale": "en_IN",
  "payload": {
    "complaintNo": "PGR-2026-000123",
    "status": "PENDINGATLME",
    "action": "ASSIGN",
    "toState": "PENDINGATLME"
  }
}
